{
  "presentation_id": "prs_SyntheticPresentation_00000001",
  "issuer": "https://kyn.usparty.party",
  "audience": "ai-for-wisconsin-pilot",
  "pairwise_subject": "pws_SyntheticParticipantKey_0001",
  "claim": {
    "type": "community_corroborated_wisconsin_connection",
    "definition_version": "0.1.0",
    "policy_version": "0.1.0"
  },
  "assurance": {
    "state": "provisional",
    "method_class": "two_independent_social_paths",
    "verification_bases": ["peer_attested"]
  },
  "issued_at": "2030-01-01T00:00:00Z",
  "expires_at": "2030-02-01T00:00:00Z",
  "status_reference": "https://kyn.usparty.party/status/synthetic-credential-0001",
  "receipt_id": "rcp_SyntheticPresentationReceipt_0000000000001",
  "proof": {
    "type": "Ed25519Signature2020",
    "key_id": "synthetic-kyn-key-1",
    "value": "AAAAAAAAAAAAAAAAAAAAAAAAAAAAAAAAAAAAAAAAAAAAAAAAAAAAAAAAAAAAAAAAAAAAAAAAAAAAAAAAAAAAAA"
  }
}
